<?xml version="1.0" encoding="UTF-8"?>
<curriculum xmlns="ejer" xmlns:xsi="http://www.w3.org/2001/XMLSchema-instance" xsi:schemaLocation="ejer TRABAJOSCHEMA.xsd">
    <datos_perso>
        <nombre>holA</nombre>
        <apellidos>asdf</apellidos>
        <fecha_nacimiento>2004-04-24</fecha_nacimiento>
        <lugar_nacimiento>dsa</lugar_nacimiento>
        <nacionalidades>
            <nacionalidad>asdf</nacionalidad>
        </nacionalidades>
        <num_identificacion>asdf</num_identificacion>
        <foto_archivo>afsd</foto_archivo>
    </datos_perso>
    <datos_contacto>
        <tipo_via></tipo_via>
        <nombre_via></nombre_via>
        <numero>1</numero>
        <portal>1</portal>
        <escalera></escalera>
        <piso>1</piso>
        <puerta></puerta>
        <codigo_postal></codigo_postal>
        <pais></pais>
        <email></email>
        <telefono_movil></telefono_movil>
        <telefono_fijo></telefono_fijo>
        <pagina_web></pagina_web>
        <redes_sociales>
            <red_social></red_social>
        </redes_sociales>
    </datos_contacto>
    <formacion_academica>
        <estudios>
            <nombre></nombre>
            <lugar_realizacion></lugar_realizacion>
            <fecha_inicio>2004-04-24</fecha_inicio>
            <fecha_fin>2004-04-24</fecha_fin>
        </estudios>
    </formacion_academica>
    <idiomas>
        <idioma>
            <nombre></nombre>
            <expresion_oral>alto</expresion_oral>
            <comprension_oral></comprension_oral>
            <expresion_escrita></expresion_escrita>
            <comprension_escrita></comprension_escrita>
            <titulo_acreditativo></titulo_acreditativo>
            <nivel_titulo>A1</nivel_titulo>
        </idioma>
    </idiomas>
    <experiencia_laboral>
        <experiencia>
            <lugar></lugar>
            <puesto></puesto>
            <fecha_inicio>2004-04-24</fecha_inicio>
            <fecha_fin>2004-04-24</fecha_fin>
        </experiencia>
    </experiencia_laboral>
    <competencias_socio_profesionales>
        <competencia>
            <nombre></nombre>
            <nivel></nivel>
        </competencia>
    </competencias_socio_profesionales>
    <datos_adicionales>
        <aficiones>
            <aficion></aficion>
        </aficiones>
        <disponibilidad_viajar>true</disponibilidad_viajar>
        <vehiculo_propio>true</vehiculo_propio>
        <licencias_permisosDecond>A1</licencias_permisosDecond>
    </datos_adicionales>
</curriculum>